<?xml version="1.0" encoding="UTF-8"?>
<?xml-stylesheet href="ejercicio-ii-1a-dtd.css"?>
<!-- ejercicio-ii-1a-dtd.xml  grupo4-->
<!DOCTYPE fichero [
		<!ELEMENT fichero (a,ficha+)>
		<!ELEMENT a (#PCDATA) >
<!ATTLIST a  
  href CDATA #IMPLIED
  xmlns CDATA #IMPLIED 
  target (_blank|_self|marco) "_blank">
		<!ELEMENT ficha (nombre, apellido, apellido, direccion*, DUI)>
		<!ELEMENT nombre (#PCDATA)>
		<!ATTLIST nombre sexo (masculino|femenino) #REQUIRED>
            	<!ATTLIST nombre edad  CDATA  #IMPLIED>
		<!ELEMENT apellido (#PCDATA) >
		<!ELEMENT direccion (#PCDATA)>
		<!ELEMENT DUI (#PCDATA) >
		]>
<fichero>
<a xmlns="http://www.w3.org/1999/xhtml" href="../../index.html" target="marco">Volver al inicio</a>
 <ficha>
  <nombre sexo="femenino" edad="17">Angelina</nombre>
  <apellido>Fernandez</apellido>
  <apellido>Martínez</apellido>
  <direccion>c/Ulises, 36</direccion>
  <direccion>av.Norte,</direccion>
  <direccion>Boulevard de los Héroes</direccion>
  <DUI>000000000</DUI>
 </ficha>
</fichero>
